,c2,c4,c5,c6
137,While simile is a mechanism for highlighting interconcept similarity  metaphor is at heart a mechanism of category inclusion  ,BackGround,SRelated,1
138,Glucksberg   notes that the same category  used figuratively  can exhibit different qualities in different metaphors,BackGround,SRelated,1
139,In this section  we describe how we use Markov chain Monte Carlo methods to perform inference in the statistical models described in the previous section Andrieu et al   provide an excellent introduction to MCMC techniques,BackGround,SRelated,1
140,These are short statements that restrict the space of languages in a concrete way for instance objectverb ordering implies adjectivenoun ordering Croft    Hawkins   and Song   provide excellent introductions to linguistic typology,BackGround,GRelated,2
141,This is a welldocumented issue see  eg    stemming from the fact that any set of languages is not sampled uniformly from the space of all probable languages,BackGround,SRelated,1
142,The closest work is represented by the books Possible and Probable Languages   and Language Classification by Numbers    but the focus of these books is on automatically discovering phylogenetic trees for languages based on IndoEuropean cognate sets  ,BackGround,GRelated,1
143,Those that reference Hawkins eg  11 are based on implications described by Hawkins   those that reference Lehmann are references to the principles decided by Lehmann   in Ch 4  8,Fundamental,Basis,1
144,They have also been used computationally to aid in the learning of unsupervised part of speech taggers  ,BackGround,GRelated,1
145,For instance our 7 is implication 18 from Greenberg  reproduced by Song  ,Fundamental,Basis,1
146,We examined sentences using a phrase structure parser   and an HPSG parser  ,Fundamental,Basis,1
147,Since the number of parameters in NLM is still large  several smoothing methods are used   to produce more accurate probabilities  and to assign nonzero probabilities to any word string,BackGround,GRelated,1
148,We would like to see more refined online learning methods with kernels   that we could apply in these areas,BackGround,MRelated,1
149,Therefore we make use of an online learning algorithm proposed by    which has a much smaller computational cost,Fundamental,Basis,1
150,Blei  2003 Wang et al  2005  our result may encourage the study ofthe combination offeatures forlanguage modeling,,,
151,We used a Viterbi decoding   for the partition,Fundamental,Basis,1
152,Discriminative language models DLMs have been proposed to classify sentences directly as correct or incorrect    and these models can handle both nonlocal and overlapping information,BackGround,GRelated,1
153,For fast kernel computation  the Polynomial Kernel Inverted method PKI is proposed    which is an extension of Inverted Index in Information Retrieval,BackGround,SRelated,1
154,The class model was originally proposed by  ,BackGround,SRelated,1
155,However  by considering only those counts that actually change  the algorithm can be made to scale somewhere between linearly and quadratically to the number of classes  ,BackGround,SRelated,1
156,Recently  Whole Sentence Maximum Entropy Models   WSMEs have been introduced,BackGround,GRelated,1
157,In our experiments  we did not examine the result of using other sampling methods  For example  it would be possible to sample sentences from a whole sentence maximum entropy model   and this is a topic for future research,BackGround,MRelated,1
158,A contrastive estimation method   is similar to ours with regard to constructing pseudonegative examples,Fundamental,Idea,1
159,If the kerneltrick   is applied to online marginbased learning  a subset of the observed examples  called the active set  needs to be stored,BackGround,SRelated,1
160,It should be noted that models based on finite state transducers have been shown to be adequate for describing fusion as well   and further work should evaluate these types of models in ASR of languages with higher indexes of fusion,BackGround,GRelated,1
161,The final approach applies a manually constructed rulebased morphological tagger ,Fundamental,Basis,1
162,For training the LMs  a subset of 43 million words from the Estonian Segakorpus was used   preprocessed with a morphological analyzer ,Fundamental,Basis,1
163,In   a WER of 445 was obtained with wordbased trigrams and a WER of 372 with items similar to ones from grammar using the same speech corpus as in this work,BackGround,SRelated,1
164,It should be noted that every OOV causes roughly two errors in recognition  and vocabulary decomposition approaches such as the ones evaluated here give some benefits to word error rate WER even in recognizing languages such as English ,BackGround,SRelated,1
165,This is similar to what was introduced as flat hybrid model   and it tries to model OOVwords as sequences of words and fragments,Fundamental,Idea,1
166,The results for hybrid are in in the range suggested by earlier work ,BackGround,SRelated,1
167,The morph approach was developed for the needs of Finnish speech recognition  which is a high synthesis  moderate fusion and very low orthographic irregularity language  whereas the hybrid approach in   was developed for English  which has low synthesis  moderate fusion  and very high orthographic irregularity,BackGround,GRelated,1
168,Varigrams  are used in this work  and to make LMs trained with each approach comparable  the varigrams have been grown to roughly sizes of 5 million counts,Fundamental,Basis,1
169,ing approach  growing varigram models  were used with no limits as to the order of ngrams  but limiting the number of counts to 48 and 5 million counts,Fundamental,Basis,1
170,For example  in English with language models LM of 60k words trained from the Gigaword Corpus V2   and testing on a very similar Voice of America portion of TDT4 speech corpora   this gives a OOV rate of 15,BackGround,SRelated,1
171,Models of this type have previously been shown to yield very good g2p conversion results  ,BackGround,GRelated,2
172,It has been argued that using morphological information is important for languages where morphology has an important influence on pronunciation  syllabiication and word stress such as German  Dutch  Swedish or  to a smaller extent  also English  ,BackGround,GRelated,1
173,Decision trees were one of the first databased approaches to g2p and are still widely used  ,BackGround,GRelated,1
174,Best results were obtained when using a variant of Modified KneserNey Smoothing 2  ,BackGround,SRelated,2
175,  also used a joint ngram model,BackGround,SRelated,1
176,We compared four different stateoftheart unsupervised systems for morphological decomposition cf  ,Compare,Compare,1
177,In very recent work    developed an unsupervised algorithm fmeas 68 an extension of RePortS whose segmentations improve g2p when using a the decision tree PER 345,BackGround,GRelated,2
178,The German corpus used in these experiments is CELEX  ,Fundamental,Basis,1
179,Among the unsupervised systems  best results 7 on the g2p task with morphological annotation were obtained with the RePortS system  ,Fundamental,Basis,2
180,The same algorithms have previously been shown to help a speech recognition task  ,BackGround,GRelated,2
181,The joint ngram model performs significantly better than the decision tree essentially based on    and achieves scores comparable to the Pronunciation by Analogy PbA algorithm  ,Compare,Compare,2
182,This is much faster than the times for Pronunciation by Analogy PbA   on the same corpus,Compare,Compare,2
183,Examples of such approaches using Hidden Markov Models are   who applied the HMM to the related task of phonemetographeme conversion    and  ,BackGround,GRelated,1
184,For German    show that information about stress assignment and the position of a syllable within a word improve g2p conversion,BackGround,GRelated,1
185,Vowel length and quality has been argued to also depend on morphological structure  ,BackGround,GRelated,1
186,The two rulebased systems we evaluated  the ETI 4 morphological system and SMOR 5    are both highquality systems with large lexica that have been developed over several years,Fundamental,Basis,2
187,We used the syllabifier described in    which works similar to the joint ngram model used for g2p conversion,Fundamental,Basis,1
188,A possible reason for the observed dichotomy in the behavior of the vowel and consonant inventories with respect to redundancy can be as follows while the organization of the vowel inventories is known to be governed by a single force  the maximal perceptual contrast    consonant inventories are shaped by a complex interplay of several forces  ,BackGround,GRelated,1
189,It has been postulated earlier by functional phonologists that such regularities are the consequences of certain general principles like maximal perceptual contrast    which is desirable between the phonemes of a language for proper perception of each individual phoneme in a noisy environment  ease of articulation    which requires that the sound systems of all languages are formed of certain universal and highly frequent sounds  and ease of learnability   which is necessary for a speaker to learn the sounds of a language with minimum effort,BackGround,GRelated,1
190,Such an observation is significant since whether or not these principles are similardifferent for the two inventories had been a question giving rise to perennial debate among the past researchers  ,BackGround,GRelated,1
191,On the other hand  in spite of several attempts   the organization of the consonant inventories lacks a satisfactory explanation,BackGround,GRelated,3
192,Various attempts have been made in the past to explain the aforementioned trends through linguistic insights   mainly establishing their statistical significance,BackGround,GRelated,1
193,For instance  in biological systems we find redundancy in the codons    in the genes   and as well in the proteins  ,BackGround,GRelated,1
194,In fact  the organization of the vowel inventories especially those with a smaller size across languages has been satisfactorily explained in terms of the single principle of maximal perceptual contrast  ,BackGround,GRelated,2
195,This redundancy is present mainly to reduce the risk of the complete loss of information that might occur due to accidental errors  ,BackGround,GRelated,1
196,Many typological studies   of segmental inventories have been carried out in past on the UCLA Phonological Segment Inventory Database UPSID  ,BackGround,GRelated,1
197,In order to explain these trends  feature economy was proposed as the organizing principle of the consonant inventories  ,BackGround,GRelated,1
198,Inspired by the aforementioned studies and the concepts of information theory   we try to quantitatively capture the amount of redundancy found across the consonant Table 1 The table shows four plosives,Fundamental,Idea,1
199,For this purpose  we present an information theoretic definition of redundancy  which is calculated based on the set of features 1   that are used to express the consonants,Fundamental,Basis,1
200,However  one of the earliest observations about the consonant inventories has been that consonants tend to occur in pairs that exhibit strong correlation in terms of their features  ,BackGround,GRelated,1
201,2 Previous Work Previous work  eg    has mostly assumed that one has a training lexicon of transliteration pairs  from which one can learn a model  often a sourcechannel or MaxEntbased model,BackGround,GRelated,1
202,A linear classifier is trained using the Winnow algorithm from the SNoW toolkit  ,Fundamental,Basis,1
203,Using comparable corpora  the namedentities for persons and locations were extracted from the English text in this paper  the English namedentities were extracted using the namedentity recognizer described in Li et al    based on the SNoW machine learning toolkit  ,Fundamental,Basis,1
204,This is quite small compared to previous approaches such as Knight and Graehl   or Gao et al  ,BackGround,SRelated,1
205,Gildea and Jurafsky   counted the number of features whose values are different  and used them as a substitution cost,BackGround,GRelated,1
206,Halle and Clements  s distinctive features are used in order to model the substitution insertiondeletion costs for the stringalignment algorithm and linear classifier,Fundamental,Basis,1
207,All pronunciations are based on the WorldBet transliteration system    an asciionly version of the IPA,Fundamental,Basis,1
208,a For all the training data  the pairs of pronunciations are aligned using standard string alignment algorithm based on Kruskal  ,Fundamental,Basis,1
209,For the set of features X and set of weights W  the linear classifier is defined as 1   X    X   X2  ,,,
210,In this paper  the phonetic transliteration is performed using the following steps 1  Generation of the pronunciation for English words and target words a Pronunciations for English words are obtained using the Festival texttospeech system  ,Fundamental,Basis,1
211,Based on the pronunciation error data of learners of English as a second language as reported in    we propose the use of what we will term pseudofeatures,Fundamental,Basis,1
212,Examples of the top3 candidates in the transliteration of EnglishKorean To evaluate the proposed transliteration methods quantitatively  the Mean Reciprocal Rank MRR  a measure commonly used in information retrieval when there is precisely one correct answer   was measured  following Tao and Zhai  ,Fundamental,Idea,1
213,In our work  we adopt the method proposed in   and apply it to the problem of transliteration,Fundamental,Basis,1
214,The substitutioninsertiondeletion cost for the string alignment algorithm is based on the baseline cost from  ,Fundamental,Basis,1
215,The pseudo features in this study are same as in Tao et al  ,Fundamental,Idea,1
216,MRRs of the phonetic transliteration The baseline was computed using the phonetic transliteration method proposed in Tao et al  ,Fundamental,Basis,1
217,By treating a lettercharacter as a word and a group of letterscharacters as a phrase or token unit in SMT  one can easily apply the traditional SMT models  such as the IBM generative model   or the phrasebased translation model   to transliteration,BackGround,GRelated,1
218,In G2P studies  Font Llitjos and Black   showed how knowledge of language of origin may improve conversion accuracy,BackGround,GRelated,1
219,Phonetic transliteration can be considered as an extension to the traditional graphemetophoneme G2P conversion    which has been a muchresearched topic in the field of speech processing,BackGround,GRelated,1
220,Many of the loanwords exist in todays Chinese through semantic transliteration  which has been well received   by the people because of many advantages,BackGround,GRelated,2
221,Unfortunately semantic transliteration  which is considered as a good tradition in translation practice    has not been adequately addressed computationally in the literature,BackGround,GRelated,3
222,5S Semantic Transliteration The performance was measured using the Mean Reciprocal Rank MRR metric    a measure that is commonly used in information retrieval  assuming there is precisely one correct answer,Fundamental,Basis,1
223,In computational linguistic literature  much effort has been devoted to phonetic transliteration  such as EnglishArabic  EnglishChinese    EnglishJapanese   and EnglishKorean,BackGround,GRelated,1
224,In the extraction of transliterations  datadriven methods are adopted to extract actual transliteration pairs from a corpus  in an effort to construct a large  uptodate transliteration lexicon  ,BackGround,GRelated,1
225,The Latinscripted personal names are always assumed to homogeneously follow the English phonic rules in automatic transliteration  ,BackGround,GRelated,1
226,This model is conceptually similar to the joint sourcechannel model   where the target token t i depends on not only its source token s i but also the history t i1 and s i 1,Fundamental,Idea,1
227,Some recent work   has attempted to introduce preference into a probabilistic framework for selection of Chinese characters in phonetic transliteration,BackGround,GRelated,1
228,In transliteration modeling  transliteration rules are trained from a large  bilingual transliteration lexicon    with the objective of translating unknown words on the fly in an open  general domain,BackGround,GRelated,1
229,As discussed elsewhere    out of several thousand common Chinese characters  a subset of a few hundred characters tends to be used overwhelmingly for transliterating English names to Chinese  egonly 731 Chinese characters are adopted in the EC corpus,BackGround,SRelated,1
230,As a Chinese transliteration can arouse to certain connotations  the choice of Chinese characters becomes a topic of interest  ,BackGround,GRelated,1
231,Table 4 Lexicon statistics For Arabic  as a fullsize Arabic lexicon was not available to us  we used the Buckwalter morphological analyzer   to derive a lexicon,Fundamental,Basis,1
232,For example    showed that factored language models  which consider morphological features and use an optimized backoff policy  yield lower perplexity,BackGround,GRelated,1
233,A recent work   experimented with EnglishtoTurkish translation with limited success  suggesting that inflection generation given morphological features may give positive results,BackGround,GRelated,1
234,More recently    achieved improvements in CzechEnglish MT  optimizing a Table 1 Morphological features used for Russian and Arabic set of possible source transformations  incorporating morphology,BackGround,GRelated,1
235,Ideally  the best word analysis should be provided as a result of contextual disambiguation eg    we leave this for future work,BackGround,MRelated,2
236,Another work   showed improvements by splitting compounds in German,BackGround,GRelated,2
237,Translating from a morphologypoor to a morphologyrich language is especially challenging since detailed morphological information needs to be decoded from a language that does not encode this information or does so only implicitly  ,BackGround,GRelated,1
238,Koehn   includes a survey of statistical MT systems in both directions for the Europarl corpus  and points out the challenges of this task,BackGround,GRelated,1
239,For example  it has been shown   that determiner segmentation and deletion in Arabic sentences in an ArabictoEnglish translation system improves sentence alignment  thus leading to improved overall translation quality,BackGround,GRelated,2
240,For Arabic  we apply the following heuristic use the most frequent analysis estimated from the gold standard labels in the Arabic Treebank   if a word does not appear in the treebank  we choose the first analysis returned by the Buckwalter analyzer,Fundamental,Basis,1
241,Our learning framework uses a Maximum Entropy Markov model  ,Fundamental,Basis,1
242,  demonstrated that a similar level of alignment quality can be achieved with smaller corpora applying morphosyntactic source restructuring  using hierarchical lexicon models  in translating from German into English,BackGround,GRelated,1
243,The sentence pairs were wordaligned using GIZA   and submitted to a treeletbased MT system    which uses the word dependency structure of the source language and projects word dependency structure to the target language  creating the structure shown in Figure 1 above,Fundamental,Basis,1
244,  experimented successfully with translating from inflectional languages into English making use of POS tags  word stems and suffixes in the source language,BackGround,GRelated,2
245,The framework suggested here is most closely related to    which uses a probabilistic model to generate Japanese case markers for EnglishtoJapanese MT,BackGround,SRelated,1
246,The algorithm is similar to the one described in  ,Fundamental,Idea,1
247,It also differs from now traditional uses of comparable corpora for detecting translation equivalents   or extracting terminology    which allows a onetoone correspondence irrespective of the context,Compare,Compare,1
248,In the spirit of    it is intended as a translators amenuensis under the tight control of a human translator ,Fundamental,Idea,1
249,It has been aligned on the sentence level by JAPA    and further on the word level by GIZA  ,Fundamental,Basis,1
250,Thus the present system is unlike SMT    where lexical selection is effected by a translation model based on aligned  parallel corpora  but the novel techniques it has developed are exploitable in the SMT paradigm,Compare,Compare,1
251,Similarity is measured as the cosine between collocation vectors  whose dimensionality is reduced by SVD using the implementation by Rapp  ,Fundamental,Basis,1
252,We have generalised the method used in our previous study   for extracting equivalents for continuous multiword expressions MWEs,Fundamental,Basis,1
253,Recent efforts in statistical machine translation MT have seen promising improvements in output quality  especially the phrasebased models   and syntaxbased models  ,BackGround,GRelated,1
254,By adapting the kbest parsing Algorithm 2 of Huang and Chiang    it achieves significant speedup over fullintegration on Chiangs Hiero system,BackGround,GRelated,2
255, We also devise a faster variant of cube pruning  called cube growing  which uses a lazy version of kbest parsing   that tries to reduce k to the minimum needed at each node to obtain the desired number of hypotheses at the root,Fundamental,Basis,1
256,In a nutshell  cube pruning works on the LM forest  keeping at most k LM items at each node  and uses the kbest parsing Algorithm 2 of Huang and Chiang   to speed up the computation,BackGround,SRelated,1
257,This situation is very similar to kbest parsing and we can adapt the Algorithm 2 of Huang and Chiang   here to explore this grid in a bestfirst order,Fundamental,Basis,1
258,This new method  called cube growing  is a lazy version of cube pruning just as Algorithm 3 of Huang and Chiang    is a lazy version of Algorithm 2 see Table 1,Fundamental,Idea,1
259,The different target sides then constitute a third dimension of the grid  forming a cube of possible combinations  ,BackGround,SRelated,1
260,The data set is same as in Section 51  except that we also parsed the Englishside using a variant of the Collins   parser  and then extracted 247M treetostring rules using the algorithm of  ,Fundamental,Basis,1
261,These forest rescoring algorithms have potential applications to other computationally intensive tasks involving combinations of different models  for example  headlexicalized parsing   joint parsing and semantic role labeling   or tagging and parsing with nonlocal features,BackGround,MRelated,1
262,In treetostring also called syntaxdirected decoding    the source string is first parsed into a tree  which is then recursively converted into a target string according to transfer rules in a synchronous grammar  ,BackGround,GRelated,1
263,We generalize cube pruning and adapt it to two systems very different from Hiero a phrasebased system similar to Pharaoh   and a treetostring system  ,Fundamental,Basis,1
264,We test our methods on two largescale EnglishtoChinese translation systems a phrasebased system and our treetostring system  ,Fundamental,Basis,1
265,Our data preparation follows Huang et al   the training data is a parallel corpus of283M words on the English side  and a trigram language model is trained on the Chinese side,Fundamental,Idea,1
266,For cube growing  we use a nonduplicate kbest method   to get 100best unique translations according to  LM to estimate the lowerbound heuristics,Fundamental,Basis,1
267,Since our treetostring rules may have many variables  we first binarize each hyperedge in the forest on the target projection  ,Fundamental,Basis,1
268,Thus we envision forest rescoring as being of general applicability for reducing complicated search spaces  as an alternative to simulated annealing methods  ,BackGround,MRelated,1
269,Part of the complexity arises from the expressive power of the translation model for example  a phrase or wordbased model with full reordering has exponential complexity  ,BackGround,GRelated,1
270,We will use the following example from Chinese to English for both systems described in this section yU  Shalong juxing le huitan with Sharon hold   past meeting held a meeting with Sharon A typical phrasebased decoder generates partial targetlanguage outputs in lefttoright order in the form of hypotheses  ,BackGround,GRelated,1
271,We implemented Cubit  a Python clone of the Pharaoh decoder    3 and adapted cube pruning to it as follows,Fundamental,Basis,1
272,We set the decoder phrasetable limit to 100 as suggested in   and the distortion limit to 4,Fundamental,Idea,1
273,An SCFG   is a contextfree rewriting system for generating string pairs,BackGround,SRelated,1
274,To integrate with a bigram language model  we can use the dynamicprogramming algorithms of Och and Ney   and Wu   for phrasebased and SCFGbased systems  respectively  which we may think of as doing a inergrained version of the deductions above,BackGround,SRelated,1
275,The language model also  if fully integrated into the decoder  introduces an expensive overhead for maintaining targetlanguage boundary words for dynamic programming  ,BackGround,GRelated,1
276,Similarly  the decoding problem with SCFGs can also be cast as a deductive parsing system  ,BackGround,SRelated,1
277,However  the hope is that by choosing the right value ofi  these estimates will be accurate enough to affect the search quality only slightly  which is analogous to almost admissible heuristics in A search  ,BackGround,SRelated,1
278,A few exceptions are the hierarchical possibly syntaxbased transduction models   and the string transduction models  ,BackGround,GRelated,1
