,c2,c4,c5,c6
557,We note that in the presence of constraints  the inference procedure for finding the output y that maximizes the cost function is usually done with search techniques rather than Viterbi decoding  see   for a discussion  we chose beamsearch decoding,BackGround,SRelated,1
558,While   showed the significance of using hard constraints  our experiments show that using soft constraints is a superior option,BackGround,GRelated,3
559,Conceptually  although not technically  the most related work to ours is   that  in a somewhat adhoc manner uses soft constraints to guide an unsupervised model that was crafted for mention tracking,BackGround,SRelated,1
560,Crucially  the kind of lexical descriptions that we employ are those that are commonly devised within lexicondriven approaches to linguistic syntax  egLexicalized TreeAdjoining Grammar   and Combinary Categorial Grammar  ,Fundamental,Basis,1
561,There are currently two supertagging approaches available LTAGbased   and CCGbased  ,BackGround,GRelated,1
562,One important way of portraying such lexical descriptions is via the supertags devised in the LTAG and CCG frameworks  ,BackGround,SRelated,2
563,The term supertagging   refers to tagging the words of a sentence  each with a supertag,BackGround,SRelated,1
564,The LTAGbased supertagger of   is a standard HMM tagger and consists of a secondorder Markov language model over supertags and a lexical model conditioning the probability of every word on its own supertag just like standard HMMbased POS taggers,BackGround,SRelated,1
565,For the LTAG supertags experiments  we used the LTAG English supertagger 5   to tag the English part of the parallel data and the supertag language model data,Fundamental,Basis,1
566,Akin to POS tagging  the process of supertagging an input utterance proceeds with statistics that are based on the probability of a wordsupertag pair given their Markovian or local context  ,BackGround,GRelated,1
567,Besides the difference in probabilities and statistical estimates  these two supertaggers differ in the way the supertags are extracted from the Penn Treebank  cf  ,BackGround,GRelated,1
568,Only quite recently have   and   shown that incorporating some form of syntactic structure could show improvements over a baseline PBSMT system,BackGround,GRelated,2
569,Among the first to demonstrate improvement when adding recursive structure was    who allows for hierarchical phrase probabilities that handle a range of reordering phenomena in the correct fashion,BackGround,GRelated,1
570,The CCG supertagger   is based on loglinear probabilities that condition a supertag on features representing its context,BackGround,SRelated,1
571,For the CCG supertag experiments  we used the CCG supertagger of   and the Edinburgh CCG tools 6 to tag the English part of the parallel corpus as well as the CCG supertag language model data,Fundamental,Basis,1
572,Both the LTAG   and the CCG supertag sets   were acquired from the WSJ section of the PennII Treebank using handbuilt extraction rules,Fundamental,Basis,1
573,Decoder The decoder used in this work is Moses  a loglinear decoder similar to Pharaoh    modified to accommodate supertag phrase probabilities and supertag language models,Fundamental,Idea,1
574,Within the field of Machine Translation  by far the most dominant paradigm is Phrasebased Statistical Machine Translation PBSMT  ,BackGround,GRelated,1
575,For example    demonstrated that adding syntax actually harmed the quality of their SMT system,BackGround,GRelated,1
576,The bidirectional word alignment is used to obtain phrase translation pairs using heuristics presented in   and    and the Moses decoder was used for phrase extraction and decoding,Fundamental,Basis,1
577,The bidirectional word alignment is used to obtain lexical phrase translation pairs using heuristics presented in   and  ,,,
578,Coming right up to date    demonstrate that syntactified target language phrases can improve translation quality for ChineseEnglish,BackGround,GRelated,2
579,While the research of   has much in common with the approach proposed here such as the syntactified target phrases  there remain a number of significant differences,BackGround,SRelated,1
580,The NIST MT03 test set is used for development  particularly for optimizing the interpolation weights using Minimum Error Rate training  ,Fundamental,Basis,1
581,Firstly  rather than induce millions of xRS rules from parallel data  we extract phrase pairs in the standard way   and associate with each phrasepair a set of target language syntactic structures based on supertag sequences,Fundamental,Basis,1
582,Table 1 presents the BLEU scores   of both systems on the NIST 2005 MT Evaluation test set,Fundamental,Basis,1
583,For less commonly used languages  one might use open source research systems  ,BackGround,MRelated,1
584,Also relevant is previous work that applied machine learning approaches to MT evaluation  both with human references   and without  ,BackGround,GRelated,1
585,METEOR uses the Porter stemmer and synonymmatching via WordNet to calculate recall and precision more accurately  ,BackGround,GRelated,1
586,As its loss function  support vector regression uses an einsensitive error function  which allows for errors within a margin of a small positive value  e  to be considered as having zero error cfBishop    pp339344,BackGround,SRelated,1
587,This can be seen as a form of confidence estimation on MT outputs  ,BackGround,GRelated,1
588,To remove the bias in the distributions of scores between different judges  we follow the normalization procedure described by Blatz et al  ,Fundamental,Idea,1
589,We conducted experiments to determine the feasibility of the proposed approach and to address the following questions 1 How informative are pseudo references inandof themselves Does varying the number andor the quality of the references have an impact on the metrics 2 What are the contributions of the adequacy features versus the fluency features to the learningbased metric 3 How do the quality and distribution of the training examples  together with the quality of the pseudo references  impact the metric training 4 Do these factors impact the metrics ability in assessing sentences produced within a single MT system How does that systems quality affect metric performance The implementation of support vector regression used for these experiments is SVMLight  ,Fundamental,Basis,1
590,To compare the relative quality of different metrics  we apply bootstrapping resampling on the data  and then use paired ttest to determine the statistical significance of the correlation differences  ,Fundamental,Basis,1
591,ROUGE utilizes skip ngrams  which allow for matches of sequences of words that are not necessarily adjacent  ,BackGround,GRelated,1
592,BLEU is smoothed    and it considers only matching up to bigrams because this has higher correlations with human judgments than when higherordered ngrams are included,BackGround,SRelated,1
593,The HWC metrics compare dependency and constituency trees for both reference and machine translations  ,BackGround,GRelated,1
594,In addition to adapting the idea of Head Word Chains    we also compared the input sentences argument structures against the treebank for certain syntactic categories,Fundamental,Idea,1
595,Referencebased metrics such as BLEU   have rephrased this subjective task as a somewhat more objective question how closely does the translation resemble sentences that are known to be good translations for the same source This approach requires the participation of human translators  who provide the gold standard reference sentences,BackGround,GRelated,1
596,The relationship between word alignments and their impact on MT is also investigated in  ,BackGround,GRelated,1
597,Most current statistical models   treat the aligned sentences in the corpus as sequences of tokens that are meant to be words the goal of the alignment process is to find links between source and target words,BackGround,GRelated,1
598,To quickly and approximately evaluate this phenomenon  we trained the statistical IBM wordalignment model 4    1 using the GIZA software   for the first two language pairs  and the Europarl corpus   for the last one,Fundamental,Basis,1
599,They can be seen as extensions of the simpler IBM models 1 and 2  ,BackGround,GRelated,1
600,We use a standard loglinear phrasebased statistical machine translation system as a baseline GIZA implementation of IBM word alignment model 4    8 the refinement and phraseextraction heuristics described in    minimumerrorrate training Table 2 ChineseEnglish corpus statistics   using Phramer    a 3gram language model with KneserNey smoothing trained with SRILM   on the English side of the training data and Pharaoh   with default settings to decode,Fundamental,Basis,1
601,We also want to bootstrap on different word aligners in particular  one possibility is to use the flexible HMM wordtophrase model of Deng and Byrne   in place of IBM model 4,BackGround,MRelated,1
602,We evaluate the reliability of these candidates  using simple metrics based on cooccurence frequencies  similar to those used in associative approaches to word alignment  ,Fundamental,Idea,1
603,Second  an increase in AER does not necessarily imply an improvement in translation quality   and viceversa  ,BackGround,SRelated,1
604,This very simple measure is frequently used in associative approaches  ,BackGround,SRelated,1
605, there is want to need not IiS in front of  as soon as  look at Figure 2 Examples of entries from the manually developed dictionary The intrinsic quality of word alignment can be assessed using the Alignment Error Rate AER metric    that compares a systems alignment output to a set of goldstandard alignment,BackGround,SRelated,1
606,The quality of the translation output is evaluated using BLEU  ,Fundamental,Basis,1
607,The experiments were carried out using the ChineseEnglish datasets provided within the IWSLT 2006 evaluation campaign    extracted from the Basic Travel Expression Corpus BTEC  ,Fundamental,Basis,1
608,For Chinese  the data provided were tokenized according to the output format of ASR systems  and humancorrected  ,Fundamental,Basis,1
609,Note that the need to consider segmentation and alignment at the same time is also mentioned in    and related issues are reported in  ,BackGround,GRelated,1
610,More importantly  however  this segmentation is often performed in a monolingual context  which makes the word alignment task more difficult since different languages may realize the same concept using varying numbers of words see eg  ,BackGround,GRelated,1
611,The loglinear model is also based on standard features conditional probabilities and lexical smoothing ofphrases in both directions  and phrase penalty  ,Fundamental,Basis,1
612,To test the influence of the initial word segmentation on the process of word packing  we considered an additional segmentation configuration  based on an automatic segmenter combining rulebased and statistical techniques  ,Fundamental,Basis,1
613,These resources follow more or less the same format as the output of the word segmenter mentioned in Section 512    so the experiments are carried out using this segmentation,Fundamental,Idea,1
614,It has been argued that METEOR correlates better with human judgment due to higher weight on recall than precision  ,BackGround,SRelated,1
615,Recently  confusion network decoding for MT system combination has been proposed  ,BackGround,GRelated,1
616,Powells method   is used to tune the system and feature weights simultaneously so as to optimize various automatic evaluation metrics on a development set,BackGround,GRelated,1
617,In this work  modified Powells method as proposed by   is used,Fundamental,Basis,1
618,Six MT systems were combined three A C E were phrasebased similar to    two B D were hierarchical similar to   and one F was syntaxbased similar to  ,Fundamental,Idea,1
619,Combination of speech recognition outputs is an example of this approach  ,BackGround,GRelated,1
620,Also  a more heuristic alignment method has been proposed in a different system combination approach  ,BackGround,GRelated,1
621,In speech recognition  confusion network decoding   has become widely used in system combination,BackGround,GRelated,1
622,In    different word orderings are taken into account by training alignment models by considering all hypothesis pairs as a parallel corpus using GIZA  ,BackGround,GRelated,1
623,Tuning is fully automatic  as opposed to   where global system weights were set manually,BackGround,GRelated,1
624,Similar combination of multiple confusion networks was presented in  ,BackGround,SRelated,1
625,The same Powells method has been used to estimate feature weights of a standard featurebased phrasal MT decoder in  ,BackGround,SRelated,1
626,The optimization of the system and feature weights may be carried out using best lists as in  ,BackGround,SRelated,1
627,Currently  the most widely used automatic MT evaluation metric is the NIST BLEU4  ,BackGround,SRelated,1
628,This work was extended in   by introducing system weights for word confidences,BackGround,GRelated,1
629,In    simple score was assigned to the word coming from the thbest hypothesis,BackGround,GRelated,1
630,In    the total confidence of the nth best confusion network hypothesis   including NULL words  given the th source sentence  was given by where is the number of nodes in the confusion network for the source sentence   is the number of translation systems  is the th system weight   c wn is the accumulated confidence for word produced by system between nodes and   and is a weight for the number of NULL links along the hypothesis ,BackGround,SRelated,1
631,The improved system combination method was compared to a simple confusion network decoding without system weights and the method proposed in   on the Arabic to English and Chinese to English NIST MT05 tasks,Compare,Compare,1
632,Compared to the baseline from    the new method improves the BLEU scores significantly,Compare,Compare,3
633,In ensemble learning  a collection of simple classifiers is used to yield better performance than any single classifier for example boosting  ,BackGround,GRelated,1
634,A modified Levenshtein alignment allowing shifts as in computation of the translation edit rate TER   was used to align hypotheses in  ,BackGround,GRelated,1
635,Minimum Bayes risk MBR was used to choose the skeleton in  ,BackGround,GRelated,1
636,This is equivalent to minimum Bayes risk decoding with uniform posterior probabilities  ,BackGround,SRelated,1
637,It has been found that multiple hypotheses from each system may be used to improve the quality of the combination output  ,BackGround,SRelated,1
638,Translation edit rate TER   has been proposed as more intuitive evaluation metric since it is based on the rate of edits required to transform the hypothesis into the reference,BackGround,SRelated,1
639,However  this would require time consuming evaluations such as human mediated TER postediting  ,BackGround,MRelated,1
640,The TnT tagger   and the TreeTagger   are used for tagging and lemmatization,Fundamental,Basis,1
641,Motivated by the theoretical work by Chafe   and Jacobs    we view the VF as the place for elements which modify the situation described in the sentence  ie,Fundamental,Idea,1
642,Finally  the articles are parsed with the CDG dependency parser  ,Fundamental,Basis,1
643,The preferences summarized below have motivated our choice of features  constituents in the nominative case precede those in other cases  and dative constituents often precede those in the accusative case    the verb arguments order depends on the verbs  subcategorization properties    constituents with a definite article precede those with an indefinite one    pronominalized constituents precede nonpronominalized ones     animate referents precede inanimate ones    short constituents precede longer ones    the preferred topic position is right after the verb    the initial position is usually occupied by scenesetting elements and topics   ,BackGround,GRelated,1
644,The sentenceinitial position  which in German is the VF  has been shown to be cognitively more prominent than other positions  ,BackGround,SRelated,1
645,Inspired by the findings of the Prague School   and Systemic Functional Linguistics    they focus on the role that information structure plays in constituent ordering,BackGround,GRelated,1
646,Harbusch et al   present a generation workbench  which has the goal of producing not the most appropriate order  but all grammatical ones,BackGround,GRelated,1
647,We suppose that this dificulty comes from the double function of the initial position which can either introduce the addressation topic  or be the scene or framesetting position  ,BackGround,MRelated,1
648,We hypothesize that the reasons which bring a constituent to the VF are different from those which place it  say  to the beginning of the MF  for the order in the MF has been shown to be relatively rigid  ,BackGround,SRelated,1
649,Since our learner treats all values as nominal  we discretized the values of dep and len with a C45 classifier  ,Fundamental,Basis,1
650,Kruijff et al   describe an architecture which supports generating the appropriate word order for different languages,BackGround,GRelated,1
651,KruijffKorbayova et al   address the task of word order generation in the same vein,BackGround,GRelated,1
652,Similar to Langkilde  Knight   we utilize statistical methods,Fundamental,Idea,1
653,Kendalls t  which has been used for evaluating sentence ordering tasks    is the second metric we use,Fundamental,Basis,1
654,Eg  in texttotext generation    new sentences are fused from dependency structures of input sentences,BackGround,GRelated,1
655,Ringger et al   aim at regenerating the order of constituents as well as the order within them for German and French technical manuals,BackGround,GRelated,1
656,Similar to Ringger et al    we find the order with the highest probability conditioned on syntactic and semantic categories,Fundamental,Idea,1
657,Apart from acc and t  we also adopt the metrics used by Uchimoto et al   and Ringger et al  ,Fundamental,Basis,1
658,According to the inv metric  our results are considerably worse than those reported by Ringger et al  ,Compare,Compare,2
659,We retrained our system on a corpus of newspaper articles   which is manually annotated but encodes no semantic knowledge,Fundamental,Basis,1
660,The work of Uchimoto et al   is done on the free word order language Japanese,BackGround,GRelated,1
661,For the fourth baseline UCHIMOTO  we utilized a maximum entropy learner OpenNLP 8 and reimplemented the algorithm of Uchimoto et al  ,Fundamental,Basis,1
662,Uszkoreit   addresses the problem from a mostly grammarbased perspective and suggests weighted constraints  such as nom  dat  pro  pro  focus  focus  etc,BackGround,GRelated,1
663,Unlike overgeneration approaches   which select the best of all possible outputs ours is more efficient  because we do not need to generate every permutation,Compare,Compare,1
664,It also compares reasonably with other more recent evaluations   which derive their input data from the penn Treebank by transforming each sentence tree into a format suitable for the realiser  ,BackGround,SRelated,1
665,For instance    reports that the implementation of such a processor for Surge was the most time consuming part of the evaluation with the resulting component containing 4000 lines of code and 900 rules,BackGround,GRelated,1
666,The realiser presented here differs in mainly two ways from existing reversible realisers such as  s CCG system or the HPSG ERG based realiser  ,Compare,Compare,1
667,The reason for this is that the grammar is compiled from a higher level description where tree fragments are first encapsulated into socalled classes and then explicitly combined by inheritance  conjunction and disjunction to produce the grammar elementary trees cf  ,BackGround,SRelated,1
668,Thus for instance  both REALPRO   and Surge   assume that the input associates semantic literals with low level syntactic and lexical information mostly leaving the realiser to just handle inflection  word order  insertion of grammatical words and agreement,BackGround,GRelated,1
669,To associate semantic representations with natural language expressions  the FTAG is modified as proposed in  ,Fundamental,Idea,1
670,The proposal draws on ideas from   and aims to determine whether for a given input a set of TAG elementary trees whose semantics equate the input semantics  syntactic requirements and resources cancel out,Fundamental,Idea,1
671,It could be used for instance  in combination with the parser and the semantic construction module described in    to support textual entailment recognition or answer detection in question answering,BackGround,GRelated,1
672,We rely on these features to associate one and the same semantic to large sets of trees denoting semantically equivalent but syntactically distinct configurations cf  ,Fundamental,Basis,1
673,The basic surface realisation algorithm used is a bottom up  tabular realisation algorithm   optimised for TAGs,Fundamental,Basis,2
674,Similarly  KPML   assumes access to ideational  interpersonal and textual information which roughly corresponds to semantic  moodvoice  themerheme and focusground information,BackGround,SRelated,1
675,In order to ensure this determinism  NLG geared realisers generally rely on theories of grammar which systematically link form to function such as systemic functional grammar SFG    and  to a lesser extent  Meaning Text Theory MTT   ,BackGround,GRelated,1
676,First  the paraphrase figures might seem low wrt to eg  work by   which mentions several thousand outputs for one given input and an average number of realisations per input varying between 857 and 1022,BackGround,SRelated,1
677,This does not seem to be the case in  s approach where the count seems to include all sentences associated by the grammar with the input semantics,BackGround,SRelated,1
678,A Featurebased TAG FTAG    consists of a set of auxiliary or initial elementary trees and of two tree composition operations substitution and adjunction,BackGround,SRelated,1
679,A first possibility would be to draw on  s proposal and compute the enriched input based on the traversal of a systemic network,BackGround,SRelated,1
680,Thus for instance    resorts to ad hoc mapping tables to associate substitution nodes with semantic indices and frnodes to constrain adjunction to the correct nodes,BackGround,GRelated,1
681,While there have been previous systems that encode generation as planning    our approach is distinguished from these systems by its focus on the grammatically specified contributions of each individual word and the TAG tree it anchors to syntax  semantics  and local pragmatics  ,BackGround,GRelated,1
682,It also allows us to benefit from the past and ongoing advances in the performance of offtheshelf planners  ,BackGround,GRelated,1
683,Unlike some approaches    we do not have to distinguish between generating NPs and expressions of other syntactic categories,Compare,Compare,1
684,The context set of an intended referent is the set of all individuals that the hearer might possibly confuse it with  ,BackGround,SRelated,1
685,It is based on the wellknown STRIPS language  ,BackGround,SRelated,2
686,The grammar formalism we use here is that of lexicalized treeadjoining grammars LTAG Joshi and Schabes  ,Fundamental,Basis,1
687,In order to use the planner as a surface realization algorithm for TAG along the lines of Koller and Striegnitz    we attach semantic content to each elementary tree and require that the sentence achieves a certain communicative goal,Fundamental,Basis,1
688,However  this problem is NPcomplete  by reduction of Hamiltonian Cycle  unsurprisingly  given that it encompasses realization  and the very similar realization problem in Koller and Striegnitz   is NPhard,BackGround,SRelated,1
689,PDDL   is the standard input language for modern planning systems,BackGround,SRelated,1
690,In a scenario that involves multiple rabbits  multiple hats  and multiple individuals that are inside other individuals  but only one pair of a rabbit r inside a hat h  the expression X takes the rabbit from the hat is sufficient to refer uniquely to r and h  ,BackGround,SRelated,1
691,We share these advantages with systems such as SPUD  ,Fundamental,Basis,1
692,This makes our encoding more direct and transparent than those in work like Thomason and Hobbs   and Stone et al  ,Compare,Compare,1
693,We follow Stone et al   in formalizing the semantic content of a lexicalized elementary tree t as a finite set of atoms but unlike in earlier approaches  we use the semantic roles in t as the arguments of these atoms,Fundamental,Idea,1
694,The three pragmatic predicates that we will use here are hearernew  indicating that the hearer does not know about the existence of an individual and cant infer it    hearerold for the opposite  and contextset,BackGround,SRelated,1
695,In addition to the semantic content  we equip every elementary tree in the grammar with a semantic requirement and a pragmatic condition  ,Fundamental,Basis,1
696,Supertag This is a variant of the approach above  but using supertags   instead of PoS tags,BackGround,SRelated,1
697,For example  the metrics proposed in Bangalore et al    such as Simple Accuracy and Generation Accuracy  measure changes with respect to a reference string based on the idea of stringedit distance,BackGround,GRelated,1
698,The judges were then presented with the 50 sentences in random order  and asked to score the sentences according to their own scale  as in magnitude estimation   these scores were then normalised in the range 0 1,Fundamental,Idea,1
